
{
  "$schema": "http://json-schema.org/draft-07/schema#",
  "title": "QuestBox Rewards Schema",
  "type": "array",
  "items": {
    "type": "object",
    "properties": {
      "id": { "type": "string" },
      "name": { "type": "string" },
      "description": { "type": "string" },
      "cost": { "type": "integer", "minimum": 0 },
      "limit": {
        "type": "object",
        "properties": {
          "type": { "type": "string", "enum": ["daily", "weekly", "monthly", "none"] },
          "count": { "type": "integer", "minimum": 1 }
        },
        "required": ["type"]
      },
      "needsApproval": { "type": "boolean" }
    },
    "required": ["id", "name", "cost", "limit"]
  }
}
